{
  "$schema": "http://json-schema.org/draft-04/schema#",
  "type": "array",
  "items": {
    "type": "object",
    "properties": {
      "_id": {
        "type": "string"
      },
      "index": {
        "type": "integer"
      },
      "guid": {
        "type": "string"
      },
      "isActive": {
        "type": "boolean"
      },
      "balance": {
        "type": "string"
      },
      "picture": {
        "type": "string"
      },
      "age": {
        "type": "integer"
      },
      "eyeColor": {
        "type": "string"
      },
      "name": {
        "type": "object",
        "properties": {
          "first": {
            "type": "string"
          },
          "last": {
            "type": "string"
          }
        },
        "required": [
          "first",
          "last"
        ]
      },
      "company": {
        "type": "string"
      },
      "email": {
        "type": "string"
      },
      "phone": {
        "type": "string"
      },
      "address": {
        "type": "string"
      },
      "about": {
        "type": "string"
      },
      "registered": {
        "type": "string"
      },
      "latitude": {
        "type": "string"
      },
      "longitude": {
        "type": "string"
      },
      "tags": {
        "type": "array",
        "items": {
          "type": "string"
        }
      },
      "range": {
        "type": "array",
        "items": {
          "type": "integer"
        }
      },
      "friends": {
        "type": "array",
        "items": {
          "type": "object",
          "properties": {
            "id": {
              "type": "integer"
            },
            "name": {
              "type": "string"
            }
          },
          "required": [
            "id",
            "name"
          ]
        }
      },
      "greeting": {
        "type": "string"
      },
      "favoriteFruit": {
        "type": "string"
      }
    },
    "required": [
      "_id",
      "index",
      "guid",
      "isActive",
      "balance",
      "picture",
      "age",
      "eyeColor",
      "name",
      "company",
      "email",
      "phone",
      "address",
      "about",
      "registered",
      "latitude",
      "longitude",
      "tags",
      "range",
      "friends",
      "greeting",
      "favoriteFruit"
    ]
  }
}